{
  "$schema":"https://json-schema.org/draft/2020-12/schema",
  "$id":"https://ctoa.local/schemas/heal-friend-shadow-scenario-pack.schema.json",
  "title":"CTOAi Heal Friend fixture scenario pack v1",
  "type":"object","additionalProperties":false,
  "required":["schema_version","fixture_only","operational_readiness_claimed","evaluated_at_unix_ms","scenarios"],
  "properties":{"schema_version":{"const":"ctoa.heal-friend-shadow-scenario-pack.v1"},"fixture_only":{"const":true},"operational_readiness_claimed":{"const":false},"evaluated_at_unix_ms":{"type":"integer","minimum":1},"scenarios":{"type":"array","minItems":1,"maxItems":64,"items":{"type":"object","additionalProperties":false,"required":["name","mutation","expected_status","expected_blockers"],"properties":{"name":{"type":"string","pattern":"^[a-z0-9][a-z0-9_-]{0,63}$"},"mutation":{"type":"string","pattern":"^[a-z0-9][a-z0-9_-]{0,63}$"},"expected_status":{"enum":["shadow_plan_ready","operational_acceptance_blocked"]},"expected_blockers":{"type":"array","maxItems":64,"uniqueItems":true,"items":{"type":"string"}}}}}}
}
