{
  "schema_version": "ctoa.heal-friend-shadow-scenario-pack.v1",
  "fixture_only": true,
  "operational_readiness_claimed": false,
  "evaluated_at_unix_ms": 1783800000000,
  "scenarios": [
    {"name":"positive_exact_target","mutation":"none","expected_status":"shadow_plan_ready","expected_blockers":[]},
    {"name":"profile_wrong_action","mutation":"profile_wrong_action","expected_status":"operational_acceptance_blocked","expected_blockers":["profile_action_mismatch"]},
    {"name":"profile_ranking_forbidden","mutation":"profile_ranking","expected_status":"operational_acceptance_blocked","expected_blockers":["profile_selection_policy_invalid"]},
    {"name":"profile_multi_target_forbidden","mutation":"profile_multi_target","expected_status":"operational_acceptance_blocked","expected_blockers":["profile_single_target_required","profile_whitelist_revision_mismatch"]},
    {"name":"profile_revision_tamper","mutation":"profile_revision","expected_status":"operational_acceptance_blocked","expected_blockers":["profile_whitelist_revision_mismatch","observation_whitelist_revision_mismatch"]},
    {"name":"profile_retry_forbidden","mutation":"profile_retry","expected_status":"operational_acceptance_blocked","expected_blockers":["profile_retry_budget_nonzero"]},
    {"name":"profile_unsafe","mutation":"profile_unsafe","expected_status":"operational_acceptance_blocked","expected_blockers":["profile_unsafe_contract","unsafe_contract"]},
    {"name":"observation_stale","mutation":"observation_stale","expected_status":"operational_acceptance_blocked","expected_blockers":["observation_stale"]},
    {"name":"party_stale","mutation":"party_stale","expected_status":"operational_acceptance_blocked","expected_blockers":["party_observation_stale"]},
    {"name":"observation_future","mutation":"observation_future","expected_status":"operational_acceptance_blocked","expected_blockers":["observation_future"]},
    {"name":"player_offline","mutation":"player_offline","expected_status":"operational_acceptance_blocked","expected_blockers":["player_offline"]},
    {"name":"player_dead","mutation":"player_dead","expected_status":"operational_acceptance_blocked","expected_blockers":["player_dead"]},
    {"name":"protection_zone","mutation":"protection_zone","expected_status":"operational_acceptance_blocked","expected_blockers":["protection_zone_inside"]},
    {"name":"target_is_self","mutation":"target_is_self","expected_status":"operational_acceptance_blocked","expected_blockers":["target_is_self"]},
    {"name":"target_id_changed","mutation":"target_id_changed","expected_status":"operational_acceptance_blocked","expected_blockers":["target_identity_mismatch"]},
    {"name":"target_name_changed","mutation":"target_name_changed","expected_status":"operational_acceptance_blocked","expected_blockers":["target_identity_mismatch"]},
    {"name":"observation_revision_changed","mutation":"observation_revision","expected_status":"operational_acceptance_blocked","expected_blockers":["observation_whitelist_revision_mismatch"]},
    {"name":"target_not_party","mutation":"target_not_party","expected_status":"operational_acceptance_blocked","expected_blockers":["party_membership_missing"]},
    {"name":"target_not_player","mutation":"target_not_player","expected_status":"operational_acceptance_blocked","expected_blockers":["target_not_player"]},
    {"name":"target_invisible","mutation":"target_invisible","expected_status":"operational_acceptance_blocked","expected_blockers":["target_not_visible"]},
    {"name":"target_different_floor","mutation":"target_different_floor","expected_status":"operational_acceptance_blocked","expected_blockers":["target_different_floor"]},
    {"name":"target_out_of_range","mutation":"target_out_of_range","expected_status":"operational_acceptance_blocked","expected_blockers":["target_out_of_range"]},
    {"name":"target_hp_changed","mutation":"target_hp_changed","expected_status":"operational_acceptance_blocked","expected_blockers":["target_hp_changed"]},
    {"name":"target_above_threshold","mutation":"target_above_threshold","expected_status":"operational_acceptance_blocked","expected_blockers":["target_above_threshold"]},
    {"name":"cooldown_active","mutation":"cooldown_active","expected_status":"operational_acceptance_blocked","expected_blockers":["cooldown_active"]},
    {"name":"cooldown_unknown","mutation":"cooldown_unknown","expected_status":"operational_acceptance_blocked","expected_blockers":["cooldown_unknown"]},
    {"name":"observation_unsafe","mutation":"observation_unsafe","expected_status":"operational_acceptance_blocked","expected_blockers":["observation_unsafe_contract","unsafe_contract"]},
    {"name":"p9_report_blocked","mutation":"p9_report_blocked","expected_status":"operational_acceptance_blocked","expected_blockers":["p9_report_not_ready","p9_receipt_report_mismatch"]},
    {"name":"p9_receipt_tampered","mutation":"p9_receipt_tampered","expected_status":"operational_acceptance_blocked","expected_blockers":["p9_receipt_invalid","p10_predecessor_mismatch"]},
    {"name":"p10_report_blocked","mutation":"p10_report_blocked","expected_status":"operational_acceptance_blocked","expected_blockers":["p10_report_not_ready","p10_receipt_report_mismatch"]},
    {"name":"p10_receipt_tampered","mutation":"p10_receipt_tampered","expected_status":"operational_acceptance_blocked","expected_blockers":["p10_receipt_invalid"]},
    {"name":"profile_wrong_spell","mutation":"profile_wrong_spell","expected_status":"operational_acceptance_blocked","expected_blockers":["profile_spell_mismatch"]},
    {"name":"profile_empty_whitelist","mutation":"profile_empty_whitelist","expected_status":"operational_acceptance_blocked","expected_blockers":["profile_single_target_required","profile_whitelist_revision_mismatch"]},
    {"name":"profile_range_invalid","mutation":"profile_range_invalid","expected_status":"operational_acceptance_blocked","expected_blockers":["profile_schema_invalid"]},
    {"name":"profile_threshold_invalid","mutation":"profile_threshold_invalid","expected_status":"operational_acceptance_blocked","expected_blockers":["profile_schema_invalid"]},
    {"name":"fixture_source_required","mutation":"fixture_source_invalid","expected_status":"operational_acceptance_blocked","expected_blockers":["fixture_source_required"]},
    {"name":"party_future","mutation":"party_future","expected_status":"operational_acceptance_blocked","expected_blockers":["party_observation_future"]},
    {"name":"player_online_unknown","mutation":"player_online_unknown","expected_status":"operational_acceptance_blocked","expected_blockers":["player_online_unknown"]},
    {"name":"player_life_unknown","mutation":"player_life_unknown","expected_status":"operational_acceptance_blocked","expected_blockers":["player_life_unknown"]},
    {"name":"protection_zone_unknown","mutation":"protection_zone_unknown","expected_status":"operational_acceptance_blocked","expected_blockers":["protection_zone_unknown"]},
    {"name":"protection_zone_untrusted","mutation":"protection_zone_untrusted","expected_status":"operational_acceptance_blocked","expected_blockers":["protection_zone_source_untrusted"]},
    {"name":"self_id_invalid","mutation":"self_id_invalid","expected_status":"operational_acceptance_blocked","expected_blockers":["self_identity_invalid"]},
    {"name":"target_id_invalid","mutation":"target_id_invalid","expected_status":"operational_acceptance_blocked","expected_blockers":["target_id_invalid","target_name_not_whitelisted","party_membership_missing"]},
    {"name":"target_not_whitelisted","mutation":"target_not_whitelisted","expected_status":"operational_acceptance_blocked","expected_blockers":["target_name_not_whitelisted"]},
    {"name":"party_duplicate","mutation":"party_duplicate","expected_status":"operational_acceptance_blocked","expected_blockers":["observation_schema_invalid"]},
    {"name":"target_hp_invalid","mutation":"target_hp_invalid","expected_status":"operational_acceptance_blocked","expected_blockers":["target_hp_invalid"]},
    {"name":"cooldown_untrusted","mutation":"cooldown_untrusted","expected_status":"operational_acceptance_blocked","expected_blockers":["cooldown_source_untrusted"]},
    {"name":"observation_ledger","mutation":"observation_ledger","expected_status":"operational_acceptance_blocked","expected_blockers":["observation_unsafe_contract"]},
    {"name":"observation_extra","mutation":"observation_extra","expected_status":"operational_acceptance_blocked","expected_blockers":["observation_schema_invalid"]},
    {"name":"observation_noncanonical_name","mutation":"observation_noncanonical_name","expected_status":"operational_acceptance_blocked","expected_blockers":["observation_schema_invalid"]},
    {"name":"p9_report_fixture_source","mutation":"p9_report_fixture_source","expected_status":"operational_acceptance_blocked","expected_blockers":["p9_report_invalid","p9_receipt_report_mismatch","p10_predecessor_mismatch"]},
    {"name":"p10_report_fixture_source","mutation":"p10_report_fixture_source","expected_status":"operational_acceptance_blocked","expected_blockers":["p10_report_not_ready","p10_receipt_report_mismatch"]},
    {"name":"p9_receipt_binding_tamper","mutation":"p9_receipt_binding_tamper","expected_status":"operational_acceptance_blocked","expected_blockers":["p9_receipt_report_mismatch","p10_predecessor_mismatch"]},
    {"name":"p10_receipt_input_tamper","mutation":"p10_receipt_input_tamper","expected_status":"operational_acceptance_blocked","expected_blockers":["p10_receipt_report_mismatch"]},
    {"name":"p10_predecessor_swap","mutation":"p10_predecessor_swap","expected_status":"operational_acceptance_blocked","expected_blockers":["p10_receipt_report_mismatch","p10_predecessor_mismatch"]}
  ]
}
